{"env":{"appId":"sentiment-classifier","environmentTag":"staging"},"feedbackRefs":[],"links":{},"messages":[{"content":"Classify this as sentiment.","role":"user","timestamp":"2026-04-17T12:00:00.000Z"}],"model":"gpt-4o","outcome":{"label":"success","reasoning":"Classifier produced a confident prediction.","score":0.87,"signals":{"calibration":0.92,"confidence":0.87}},"provider":{"name":"openai"},"redactions":[],"schemaVersion":"1.0","source":{"emitter":"sdk","sdk":{"name":"autocontext-ts","version":"0.0.0"}},"timing":{"endedAt":"2026-04-17T12:00:00.800Z","latencyMs":800,"startedAt":"2026-04-17T12:00:00.000Z"},"toolCalls":[],"traceId":"01HZ6X2K7M9A3B4C5D6E7F8G9H","usage":{"tokensIn":20,"tokensOut":5}}
