{"env":{"appId":"summarizer","environmentTag":"production"},"feedbackRefs":[{"kind":"thumbs","ref":"fb-thumb-123","score":1,"submittedAt":"2026-04-17T12:01:00.000Z"},{"comment":"Helpful summary","kind":"rating","ref":"fb-rating-456","score":4,"submittedAt":"2026-04-17T12:02:00.000Z"}],"links":{},"messages":[{"content":"Summarize this.","role":"user","timestamp":"2026-04-17T12:00:00.000Z"}],"model":"gpt-4o-mini","provider":{"name":"openai"},"redactions":[],"schemaVersion":"1.0","source":{"emitter":"sdk","sdk":{"name":"autocontext-ts","version":"0.0.0"}},"timing":{"endedAt":"2026-04-17T12:00:01.000Z","latencyMs":1000,"startedAt":"2026-04-17T12:00:00.000Z"},"toolCalls":[],"traceId":"01HZ6X2K7M9A3B4C5D6E7F8G9H","usage":{"tokensIn":100,"tokensOut":30}}
