{"env":{"appId":"math-bot","environmentTag":"production"},"feedbackRefs":[],"links":{},"messages":[{"content":"Quick math: 2 + 2?","role":"user","timestamp":"2026-04-17T12:00:00.000Z"}],"model":"gpt-4o-mini","provider":{"name":"openai"},"redactions":[],"routing":{"chosen":{"endpoint":"https://api.openai.com/v1","model":"gpt-4o-mini","provider":"openai"},"evaluatedAt":"2026-04-17T12:00:00.010Z","matchedRouteId":"route-cheap-default","reason":"matched-route"},"schemaVersion":"1.0","source":{"emitter":"sdk","sdk":{"name":"autocontext-ts","version":"0.0.0"}},"timing":{"endedAt":"2026-04-17T12:00:00.300Z","latencyMs":300,"startedAt":"2026-04-17T12:00:00.000Z"},"toolCalls":[],"traceId":"01HZ6X2K7M9A3B4C5D6E7F8G9H","usage":{"tokensIn":8,"tokensOut":4}}
