{"env":{"appId":"parity-test-app","environmentTag":"test"},"feedbackRefs":[],"links":{},"messages":[{"content":"Hello","role":"user","timestamp":"2024-01-01T00:00:00Z"},{"content":"Hello there!","role":"assistant","timestamp":"2024-01-01T00:00:00Z"}],"metadata":{"anthropicStopReason":"end_turn"},"model":"claude-3-5-sonnet-20241022","outcome":{"label":"success"},"provider":{"name":"anthropic"},"redactions":[],"schemaVersion":"1.0","source":{"emitter":"sdk","sdk":{"name":"autocontext-sdk","version":"0.0.0"}},"timing":{"endedAt":"2024-01-01T00:00:01Z","latencyMs":1000,"startedAt":"2024-01-01T00:00:00Z"},"toolCalls":[],"traceId":"PARITY_TRACE_ID_NORMALIZED","usage":{"providerUsage":{"cacheCreationInputTokens":0,"cacheReadInputTokens":0,"inputTokens":5,"outputTokens":4},"tokensIn":5,"tokensOut":4}}
