{
  "schemaVersion": "1.0",
  "traceId": "01KPHTAACKMFPPGJWSKRW8W1KA",
  "source": {
    "emitter": "sdk",
    "sdk": { "name": "autocontext-ts", "version": "0.4.3" }
  },
  "provider": { "name": "openai" },
  "model": "gpt-4o-mini",
  "env": { "environmentTag": "production", "appId": "my-app" },
  "messages": [
    { "role": "user", "content": "hello", "timestamp": "2026-04-17T12:00:00.000Z" }
  ],
  "toolCalls": [],
  "timing": {
    "startedAt": "2026-04-17T12:00:00.000Z",
    "endedAt": "2026-04-17T12:00:01.000Z",
    "latencyMs": 1000
  },
  "usage": { "tokensIn": 10, "tokensOut": 5 },
  "feedbackRefs": [],
  "links": {},
  "redactions": []
}
