{"env":{"appId":"test-app","environmentTag":"staging"},"feedbackRefs":[],"links":{},"messages":[{"content":"Hi.","role":"user","timestamp":"2026-04-17T12:00:00.000Z"}],"metadata":{"array_of_things":[1,2,"three",{"four":4}],"bucket":"control","experimentId":"exp-42","nested":{"a_first_key":2,"middle":{"deep":"value"},"z_last_key":1}},"model":"gpt-4o-mini","provider":{"name":"openai"},"redactions":[],"schemaVersion":"1.0","source":{"emitter":"sdk","sdk":{"name":"autocontext-ts","version":"0.0.0"}},"timing":{"endedAt":"2026-04-17T12:00:00.100Z","latencyMs":100,"startedAt":"2026-04-17T12:00:00.000Z"},"toolCalls":[],"traceId":"01HZ6X2K7M9A3B4C5D6E7F8G9H","usage":{"tokensIn":1,"tokensOut":1}}
