{"env":{"appId":"support-bot","environmentTag":"production"},"feedbackRefs":[],"links":{},"messages":[{"content":"Hi.","role":"user","timestamp":"2026-04-17T12:00:00.000Z"}],"model":"gpt-4o-mini","provider":{"name":"openai"},"redactions":[],"schemaVersion":"1.0","session":{"requestId":"req-abc","sessionIdHash":"0000000000000000000000000000000000000000000000000000000000000002","userIdHash":"0000000000000000000000000000000000000000000000000000000000000001"},"source":{"emitter":"sdk","sdk":{"name":"autocontext-ts","version":"0.0.0"}},"timing":{"endedAt":"2026-04-17T12:00:00.500Z","latencyMs":500,"startedAt":"2026-04-17T12:00:00.000Z"},"toolCalls":[],"traceId":"01HZ6X2K7M9A3B4C5D6E7F8G9H","usage":{"tokensIn":5,"tokensOut":10}}
