{"env":{"appId":"parity-test-app","environmentTag":"test"},"feedbackRefs":[],"links":{},"messages":[{"content":"Service overloaded","role":"user","timestamp":"2024-01-01T00:00:00Z"}],"model":"claude-3-5-sonnet-20241022","outcome":{"error":{"message":"NORMALIZED","stack":"NORMALIZED","type":"NORMALIZED"},"label":"failure"},"provider":{"name":"anthropic"},"redactions":[],"schemaVersion":"1.0","source":{"emitter":"sdk","sdk":{"name":"autocontext-sdk","version":"0.0.0"}},"timing":{"endedAt":"2024-01-01T00:00:01Z","latencyMs":1000,"startedAt":"2024-01-01T00:00:00Z"},"toolCalls":[],"traceId":"PARITY_TRACE_ID_NORMALIZED","usage":{"tokensIn":0,"tokensOut":0}}
