{"env":{"appId":"parity-test-app","environmentTag":"test"},"feedbackRefs":[],"links":{},"messages":[{"content":"What is the weather in NYC?","role":"user","timestamp":"2024-01-01T00:00:00Z"}],"model":"gpt-4o","outcome":{"label":"success"},"provider":{"name":"openai"},"redactions":[],"schemaVersion":"1.0","source":{"emitter":"sdk","sdk":{"name":"autocontext-sdk","version":"0.0.0"}},"timing":{"endedAt":"2024-01-01T00:00:01Z","latencyMs":1000,"startedAt":"2024-01-01T00:00:00Z"},"toolCalls":[{"args":{"location":"New York"},"toolName":"get_weather"}],"traceId":"PARITY_TRACE_ID_NORMALIZED","usage":{"tokensIn":20,"tokensOut":15}}
