{"env":{"appId":"weather-bot","environmentTag":"production"},"feedbackRefs":[],"links":{},"messages":[{"content":"What's the weather in Tokyo?","role":"user","timestamp":"2026-04-17T12:00:00.000Z"},{"content":"Let me check.","role":"assistant","timestamp":"2026-04-17T12:00:00.500Z"}],"model":"claude-sonnet-4-20250514","provider":{"name":"anthropic"},"redactions":[],"schemaVersion":"1.0","source":{"emitter":"sdk","sdk":{"name":"autocontext-ts","version":"0.0.0"}},"timing":{"endedAt":"2026-04-17T12:00:02.000Z","latencyMs":2000,"startedAt":"2026-04-17T12:00:00.000Z"},"toolCalls":[{"args":{"city":"Tokyo","units":"celsius"},"durationMs":120,"result":{"conditions":"cloudy","temp":18},"toolName":"weather_lookup"}],"traceId":"01HZ6X2K7M9A3B4C5D6E7F8G9H","usage":{"tokensIn":42,"tokensOut":88}}
