{"env":{"appId":"parity-test-app","environmentTag":"test"},"feedbackRefs":[],"links":{},"messages":[{"content":"What is the weather in NYC?","role":"user","timestamp":"2024-01-01T00:00:00Z"},{"content":"","role":"assistant","timestamp":"2024-01-01T00:00:00Z"}],"metadata":{"anthropicStopReason":"tool_use"},"model":"claude-3-5-sonnet-20241022","outcome":{"label":"success"},"provider":{"name":"anthropic"},"redactions":[],"schemaVersion":"1.0","source":{"emitter":"sdk","sdk":{"name":"autocontext-sdk","version":"0.0.0"}},"timing":{"endedAt":"2024-01-01T00:00:01Z","latencyMs":1000,"startedAt":"2024-01-01T00:00:00Z"},"toolCalls":[{"args":{"location":"New York"},"toolName":"get_weather"}],"traceId":"PARITY_TRACE_ID_NORMALIZED","usage":{"providerUsage":{"cacheCreationInputTokens":0,"cacheReadInputTokens":0,"inputTokens":20,"outputTokens":15},"tokensIn":20,"tokensOut":15}}
