{"env":{"appId":"parity-test-app","environmentTag":"test"},"feedbackRefs":[],"links":{},"messages":[{"content":"Hello with session","role":"user","timestamp":"2024-01-01T00:00:00Z"},{"content":"Hello with session!","role":"assistant","timestamp":"2024-01-01T00:00:00Z"}],"metadata":{"anthropicStopReason":"end_turn"},"model":"claude-3-5-sonnet-20241022","outcome":{"label":"success"},"provider":{"name":"anthropic"},"redactions":[],"schemaVersion":"1.0","session":{"sessionIdHash":"e667a89ad7c3fd2dcc51f585692c660b28534148e2d989dee665fa968731d8ff","userIdHash":"360822b6dc30e23313726f42ce469bf563d456b85482fa8053aee7face99c3ae"},"source":{"emitter":"sdk","sdk":{"name":"autocontext-sdk","version":"0.0.0"}},"timing":{"endedAt":"2024-01-01T00:00:01Z","latencyMs":1000,"startedAt":"2024-01-01T00:00:00Z"},"toolCalls":[],"traceId":"PARITY_TRACE_ID_NORMALIZED","usage":{"providerUsage":{"cacheCreationInputTokens":0,"cacheReadInputTokens":0,"inputTokens":8,"outputTokens":5},"tokensIn":8,"tokensOut":5}}
